{
  "schema": "orf.naming.components.v3",
  "status": "SOURCE_ONLY_CANDIDATE",
  "components": [
    {
      "component_id": "orf.framework",
      "project_id": "OpenRemaster",
      "edition_id": null,
      "artifact_id": null,
      "canonical_name": "Framework",
      "display_name": "Framework",
      "legacy_aliases": [],
      "owner": null,
      "source_path": null,
      "manifest_path": null,
      "version": null,
      "provenance": [
        {
          "path": "docs/naming-harmonization.md",
          "sha256": "eab7522f84407b68d85c9f8162c8f58c4791d6210275c8d8ff288c2f6e23653c",
          "role": "PORTABLE_EXAMPLE_ONLY_NOT_SOURCE_OR_OWNER_AUTHORITY"
        }
      ],
      "dependencies": [],
      "verification_state": "VERIFIED_PARTIAL",
      "migration_state": "SAFE_WITH_ALIAS",
      "component_type": "Shared component"
    },
    {
      "component_id": "orf.orchestrator",
      "project_id": "OpenRemaster",
      "edition_id": null,
      "artifact_id": null,
      "canonical_name": "Orchestrator",
      "display_name": "Orchestrator",
      "legacy_aliases": [],
      "owner": null,
      "source_path": null,
      "manifest_path": null,
      "version": null,
      "provenance": [
        {
          "path": "docs/naming-harmonization.md",
          "sha256": "eab7522f84407b68d85c9f8162c8f58c4791d6210275c8d8ff288c2f6e23653c",
          "role": "PORTABLE_EXAMPLE_ONLY_NOT_SOURCE_OR_OWNER_AUTHORITY"
        }
      ],
      "dependencies": [],
      "verification_state": "VERIFIED_PARTIAL",
      "migration_state": "SAFE_WITH_ALIAS",
      "component_type": "Shared component"
    },
    {
      "component_id": "orf.studio",
      "project_id": "OpenRemaster",
      "edition_id": null,
      "artifact_id": null,
      "canonical_name": "Studio",
      "display_name": "Studio",
      "legacy_aliases": [],
      "owner": null,
      "source_path": null,
      "manifest_path": null,
      "version": null,
      "provenance": [
        {
          "path": "docs/naming-harmonization.md",
          "sha256": "eab7522f84407b68d85c9f8162c8f58c4791d6210275c8d8ff288c2f6e23653c",
          "role": "PORTABLE_EXAMPLE_ONLY_NOT_SOURCE_OR_OWNER_AUTHORITY"
        }
      ],
      "dependencies": [],
      "verification_state": "VERIFIED_PARTIAL",
      "migration_state": "SAFE_WITH_ALIAS",
      "component_type": "Shared component"
    },
    {
      "component_id": "orf.worker.development",
      "project_id": "OpenRemaster",
      "edition_id": null,
      "artifact_id": null,
      "canonical_name": "Development Worker",
      "display_name": "Development Worker",
      "legacy_aliases": [],
      "owner": null,
      "source_path": null,
      "manifest_path": null,
      "version": null,
      "provenance": [
        {
          "path": "docs/naming-harmonization.md",
          "sha256": "eab7522f84407b68d85c9f8162c8f58c4791d6210275c8d8ff288c2f6e23653c",
          "role": "PORTABLE_EXAMPLE_ONLY_NOT_SOURCE_OR_OWNER_AUTHORITY"
        }
      ],
      "dependencies": [],
      "verification_state": "VERIFIED_PARTIAL",
      "migration_state": "SAFE_WITH_ALIAS",
      "component_type": "Shared component"
    },
    {
      "component_id": "orf.worker.production",
      "project_id": "OpenRemaster",
      "edition_id": null,
      "artifact_id": null,
      "canonical_name": "Production Worker",
      "display_name": "Production Worker",
      "legacy_aliases": [],
      "owner": null,
      "source_path": null,
      "manifest_path": null,
      "version": null,
      "provenance": [
        {
          "path": "docs/naming-harmonization.md",
          "sha256": "eab7522f84407b68d85c9f8162c8f58c4791d6210275c8d8ff288c2f6e23653c",
          "role": "PORTABLE_EXAMPLE_ONLY_NOT_SOURCE_OR_OWNER_AUTHORITY"
        }
      ],
      "dependencies": [],
      "verification_state": "VERIFIED_PARTIAL",
      "migration_state": "SAFE_WITH_ALIAS",
      "component_type": "Shared component"
    },
    {
      "component_id": "orf.execution.control",
      "project_id": "OpenRemaster",
      "edition_id": null,
      "artifact_id": null,
      "canonical_name": "Execution Control",
      "display_name": "Execution Control",
      "legacy_aliases": [
        "K003"
      ],
      "owner": null,
      "source_path": null,
      "manifest_path": null,
      "version": null,
      "provenance": [
        {
          "path": "docs/naming-harmonization.md",
          "sha256": "eab7522f84407b68d85c9f8162c8f58c4791d6210275c8d8ff288c2f6e23653c",
          "role": "PORTABLE_EXAMPLE_ONLY_NOT_SOURCE_OR_OWNER_AUTHORITY"
        }
      ],
      "dependencies": [],
      "verification_state": "VERIFIED_PARTIAL",
      "migration_state": "SAFE_WITH_ALIAS",
      "component_type": "Shared component"
    },
    {
      "component_id": "orf.orion.pks",
      "project_id": "OpenRemaster",
      "edition_id": null,
      "artifact_id": null,
      "canonical_name": "Project Knowledge",
      "display_name": "Project Knowledge",
      "legacy_aliases": [],
      "owner": null,
      "source_path": null,
      "manifest_path": null,
      "version": null,
      "provenance": [
        {
          "path": "docs/naming-harmonization.md",
          "sha256": "eab7522f84407b68d85c9f8162c8f58c4791d6210275c8d8ff288c2f6e23653c",
          "role": "PORTABLE_EXAMPLE_ONLY_NOT_SOURCE_OR_OWNER_AUTHORITY"
        }
      ],
      "dependencies": [],
      "verification_state": "VERIFIED_PARTIAL",
      "migration_state": "SAFE_WITH_ALIAS",
      "component_type": "Shared component"
    },
    {
      "component_id": "orf.runtime.dios",
      "project_id": "OpenRemaster",
      "edition_id": null,
      "artifact_id": null,
      "canonical_name": "DOSBox Isolation",
      "display_name": "DOSBox Isolation",
      "legacy_aliases": [],
      "owner": null,
      "source_path": null,
      "manifest_path": null,
      "version": null,
      "provenance": [
        {
          "path": "docs/naming-harmonization.md",
          "sha256": "eab7522f84407b68d85c9f8162c8f58c4791d6210275c8d8ff288c2f6e23653c",
          "role": "PORTABLE_EXAMPLE_ONLY_NOT_SOURCE_OR_OWNER_AUTHORITY"
        }
      ],
      "dependencies": [],
      "verification_state": "VERIFIED_PARTIAL",
      "migration_state": "SAFE_WITH_ALIAS",
      "component_type": "Shared component"
    },
    {
      "component_id": "orf.execution.gateway",
      "project_id": "OpenRemaster",
      "edition_id": null,
      "artifact_id": null,
      "canonical_name": "Execution Gateway",
      "display_name": "Execution Gateway",
      "legacy_aliases": [],
      "owner": null,
      "source_path": null,
      "manifest_path": null,
      "version": null,
      "provenance": [
        {
          "path": "docs/naming-harmonization.md",
          "sha256": "eab7522f84407b68d85c9f8162c8f58c4791d6210275c8d8ff288c2f6e23653c",
          "role": "PORTABLE_EXAMPLE_ONLY_NOT_SOURCE_OR_OWNER_AUTHORITY"
        }
      ],
      "dependencies": [],
      "verification_state": "UNKNOWN",
      "migration_state": "BLOCKED_BY_PROVENANCE",
      "component_type": "Shared component"
    },
    {
      "component_id": "orf.orion.olip",
      "project_id": "OpenRemaster",
      "edition_id": null,
      "artifact_id": null,
      "canonical_name": "ORION Local Intelligence",
      "display_name": "ORION Local Intelligence",
      "legacy_aliases": [],
      "owner": null,
      "source_path": null,
      "manifest_path": null,
      "version": null,
      "provenance": [
        {
          "path": "docs/naming-harmonization.md",
          "sha256": "eab7522f84407b68d85c9f8162c8f58c4791d6210275c8d8ff288c2f6e23653c",
          "role": "PORTABLE_EXAMPLE_ONLY_NOT_SOURCE_OR_OWNER_AUTHORITY"
        }
      ],
      "dependencies": [],
      "verification_state": "UNKNOWN",
      "migration_state": "BLOCKED_BY_PROVENANCE",
      "component_type": "Shared component"
    },
    {
      "component_id": "orf.localization.studio",
      "project_id": "OpenRemaster",
      "edition_id": null,
      "artifact_id": null,
      "canonical_name": "Localization Studio",
      "display_name": "Localization Studio",
      "legacy_aliases": [],
      "owner": null,
      "source_path": null,
      "manifest_path": null,
      "version": null,
      "provenance": [
        {
          "path": "docs/naming-harmonization.md",
          "sha256": "eab7522f84407b68d85c9f8162c8f58c4791d6210275c8d8ff288c2f6e23653c",
          "role": "PORTABLE_EXAMPLE_ONLY_NOT_SOURCE_OR_OWNER_AUTHORITY"
        }
      ],
      "dependencies": [],
      "verification_state": "UNKNOWN",
      "migration_state": "BLOCKED_BY_PROVENANCE",
      "component_type": "Shared component"
    },
    {
      "component_id": "orf.security.witness",
      "project_id": "OpenRemaster",
      "edition_id": null,
      "artifact_id": null,
      "canonical_name": "Security and Witness",
      "display_name": "Security and Witness",
      "legacy_aliases": [],
      "owner": null,
      "source_path": null,
      "manifest_path": null,
      "version": null,
      "provenance": [
        {
          "path": "docs/naming-harmonization.md",
          "sha256": "eab7522f84407b68d85c9f8162c8f58c4791d6210275c8d8ff288c2f6e23653c",
          "role": "PORTABLE_EXAMPLE_ONLY_NOT_SOURCE_OR_OWNER_AUTHORITY"
        }
      ],
      "dependencies": [],
      "verification_state": "UNKNOWN",
      "migration_state": "BLOCKED_BY_PROVENANCE",
      "component_type": "Shared component"
    },
    {
      "component_id": "orf.evidence.registry",
      "project_id": "OpenRemaster",
      "edition_id": null,
      "artifact_id": null,
      "canonical_name": "Evidence Registry",
      "display_name": "Evidence Registry",
      "legacy_aliases": [],
      "owner": null,
      "source_path": null,
      "manifest_path": null,
      "version": null,
      "provenance": [
        {
          "path": "docs/naming-harmonization.md",